mysql> select * from AdressBookSer;
+-----------+----------+--------+-----------+-------+---------+----------+---------------+
| FirstName | LastName | Adress | City      | State | PinCode | PhoneNum | Email         |
+-----------+----------+--------+-----------+-------+---------+----------+---------------+
| ABC       | XYZ      | A301QQ | Allahabad | UP    | 211001  | 893488   | abc@gmail.com |
| ABC       | XYZ      | A301QQ | Allahabad | UP    | 211001  | 893488   | abc@gmail.com |
| ABC       | XYZ      | A301QQ | Allahabad | UP    | 111111  | 893488   | abc@gmail.com |
+-----------+----------+--------+-----------+-------+---------+----------+---------------+
3 rows in set (0.00 sec)

mysql> update AdressBookSer set FirstName = 'XYZ', Adress = 'Lucknow' WHERE PinCode=111111;
Query OK, 1 row affected (0.01 sec)
Rows matched: 1  Changed: 1  Warnings: 0

mysql> select * from AdressBookSer;
+-----------+----------+---------+-----------+-------+---------+----------+---------------+
| FirstName | LastName | Adress  | City      | State | PinCode | PhoneNum | Email         |
+-----------+----------+---------+-----------+-------+---------+----------+---------------+
| ABC       | XYZ      | A301QQ  | Allahabad | UP    | 211001  | 893488   | abc@gmail.com |
| ABC       | XYZ      | A301QQ  | Allahabad | UP    | 211001  | 893488   | abc@gmail.com |
| XYZ       | XYZ      | Lucknow | Allahabad | UP    | 111111  | 893488   | abc@gmail.com |
+-----------+----------+---------+-----------+-------+---------+----------+---------------+
3 rows in set (0.00 sec)

mysql>