mysql> select * from AdressBookSer;
+-----------+----------+--------+-----------+-------+---------+----------+---------------+
| FirstName | LastName | Adress | City      | State | PinCode | PhoneNum | Email         |
+-----------+----------+--------+-----------+-------+---------+----------+---------------+
| ABC       | XYZ      | A301QQ | Allahabad | UP    | 211001  | 893488   | abc@gmail.com |
| ABC       | XYZ      | A301QQ | Allahabad | UP    | 211001  | 893488   | abc@gmail.com |
| ABC       | XYZ      | A301QQ | Allahabad | UP    | 111111  | 893488   | abc@gmail.com |
+-----------+----------+--------+-----------+-------+---------+----------+---------------+
3 rows in set (0.00 sec)

mysql> update AdressBookSer set FirstName = 'XYZ', Adress = 'Lucknow' WHERE PinCode=111111;
Query OK, 1 row affected (0.01 sec)
Rows matched: 1  Changed: 1  Warnings: 0

mysql> select * from AdressBookSer;
+-----------+----------+---------+-----------+-------+---------+----------+---------------+
| FirstName | LastName | Adress  | City      | State | PinCode | PhoneNum | Email         |
+-----------+----------+---------+-----------+-------+---------+----------+---------------+
| ABC       | XYZ      | A301QQ  | Allahabad | UP    | 211001  | 893488   | abc@gmail.com |
| ABC       | XYZ      | A301QQ  | Allahabad | UP    | 211001  | 893488   | abc@gmail.com |
| XYZ       | XYZ      | Lucknow | Allahabad | UP    | 111111  | 893488   | abc@gmail.com |
+-----------+----------+---------+-----------+-------+---------+----------










mysql> DELETE FROM AdressBookSer where FirstName = 'XYZ';
Query OK, 1 row affected  (0.01 sec)

mysql> select * from AdressBookSer;
+-----------+----------+--------+-----------+-------+---------+----------+---------------+
| FirstName | LastName | Adress | City      | State | PinCode | PhoneNum | Email         |
+-----------+----------+--------+-----------+-------+---------+----------+---------------+
| ABC       | XYZ      | A301QQ | Allahabad | UP    | 211001  | 893488   | abc@gmail.com |
| ABC       | XYZ      | A301QQ | Allahabad | UP    | 211001  | 893488   | abc@gmail.com |
+-----------+----------+--------+-----------+-------+---------+----------+---------------+
2 rows in set (0.00 sec)







mysql> select * from AdressBookSer;
+-----------+----------+--------+-----------+-------+---------+----------+---------------+
| FirstName | LastName | Adress | City      | State | PinCode | PhoneNum | Email         |
+-----------+----------+--------+-----------+-------+---------+----------+---------------+
| ABC       | XYZ      | A301QQ | Allahabad | UP    | 211001  | 893488   | abc@gmail.com |
| ABC       | XYZ      | A301QQ | Allahabad | UP    | 211001  | 893488   | abc@gmail.com |
| ABC       | XYZ      | A301QQ | A         | UP    | 211001  | 893488   | abc@gmail.com |
| ABC       | XYZ      | A301QQ | B         | UP    | 211001  | 893488   | abc@gmail.com |
| ABC       | XYZ      | A301QQ | C         | UP    | 211001  | 893488   | abc@gmail.com |
| ABC       | XYZ      | A301QQ | D         | UP    | 211001  | 893488   | abc@gmail.com |
+-----------+----------+--------+-----------+-------+---------+----------+---------------+
6 rows in set (0.00 sec)

mysql> select * from AdressBookSer WHERE Adress = 'A';
Empty set (0.00 sec)

mysql> select * from AdressBookSer WHERE City = 'A';
+-----------+----------+--------+------+-------+---------+----------+---------------+
| FirstName | LastName | Adress | City | State | PinCode | PhoneNum | Email         |
+-----------+----------+--------+------+-------+---------+----------+---------------+
| ABC       | XYZ      | A301QQ | A    | UP    | 211001  | 893488   | abc@gmail.com |
+-----------+----------+--------+------+-------+---------+----------+---------------+
1 row in set (0.00 sec)

mysql>



mysql> use world;
Database changed
mysql> select * FROM AdressBookSer;
+-----------+----------+--------+-----------+-------+---------+----------+---------------+
| FirstName | LastName | Adress | City      | State | PinCode | PhoneNum | Email         |
+-----------+----------+--------+-----------+-------+---------+----------+---------------+
| ABC       | XYZ      | A301QQ | Allahabad | UP    | 211001  | 893488   | abc@gmail.com |
| ABC       | XYZ      | A301QQ | Allahabad | UP    | 211001  | 893488   | abc@gmail.com |
| ABC       | XYZ      | A301QQ | A         | UP    | 211001  | 893488   | abc@gmail.com |
| ABC       | XYZ      | A301QQ | B         | UP    | 211001  | 893488   | abc@gmail.com |
| ABC       | XYZ      | A301QQ | C         | UP    | 211001  | 893488   | abc@gmail.com |
| ABC       | XYZ      | A301QQ | D         | UP    | 211001  | 893488   | abc@gmail.com |
+-----------+----------+--------+-----------+-------+---------+----------+---------------+
6 rows in set (0.00 sec)

mysql> SELECT COUNT(*) FROM AdressBookSer;
+----------+
| COUNT(*) |
+----------+
|        6 |
+----------+
1 row in set (0.01 sec)












ERROR 1064 (42000): You have an error in your SQL syntax; check the manual that corresponds to your MySQL server version for the right syntax to use near '[WHERE conditions]' at line 3
mysql> SELECT * FROM AdressBookSer ORDER BY City;
+-----------+----------+--------+-----------+-------+---------+----------+---------------+
| FirstName | LastName | Adress | City      | State | PinCode | PhoneNum | Email         |
+-----------+----------+--------+-----------+-------+---------+----------+---------------+
| ABC       | XYZ      | A301QQ | A         | UP    | 211001  | 893488   | abc@gmail.com |
| ABC       | XYZ      | A301QQ | Allahabad | UP    | 211001  | 893488   | abc@gmail.com |
| ABC       | XYZ      | A301QQ | Allahabad | UP    | 211001  | 893488   | abc@gmail.com |
| ABC       | XYZ      | A301QQ | B         | UP    | 211001  | 893488   | abc@gmail.com |
| ABC       | XYZ      | A301QQ | C         | UP    | 211001  | 893488   | abc@gmail.com |
| ABC       | XYZ      | A301QQ | D         | UP    | 211001  | 893488   | abc@gmail.com |
+-----------+----------+--------+-----------+-------+---------+----------+---------------+
6 rows in set (0.00 sec)



mysql>+---------------+
3 rows in set (0.00 sec)

mysql>